Index,Keyword,Tweets
0,StarWars,may force
1,StarWars,RT amp follow chance WIN Kylo Ren Pop
2,StarWars,About last night premiere London
3,StarWars,About last night premiere London
4,StarWars,Are allowed love anymore
5,StarWars,Your journey nears end See theaters tonight
6,StarWars,Nothing prepare end playing theaters Get tickets
7,StarWars,Spoilers context
8,StarWars,Whilst overall enjoyable film serious issues Pretty good summary everything
9,StarWars,RT amp follow chance WIN Kylo Ren Pop
10,StarWars,MOVIE REVIEW Spoiler free via
11,StarWars,Took pause work I 'm great worker btw Watching instead job And next scene
12,StarWars,Star Wars The Funko Pop line started amp continues today hundreds figures
13,StarWars,Went pregnant wife felt baby kick first time show You ama
14,StarWars,Rian Johnson JJ Abrams arguing direction sequel trilogy taken colorized
15,StarWars,RT amp follow chance WIN Kylo Ren Pop
16,StarWars,fantastic fingers crossed RT RT RT amp follow chance WIN
17,StarWars,This one 's I think plenty
18,StarWars,Time viewing number hours sleep
19,StarWars,May rugby
20,StarWars,Lest forget four years ago greatest promotional interview ever
21,StarWars,please stop talking Bo reviews possible spoilers Stop tyvm
22,StarWars,The new Star Wars movies never better original Star Wars
23,StarWars,When friday And feeling force
24,StarWars,way x
25,StarWars,Liftoff The ... trending today
26,StarWars,A good Night one brothas ... missing one Lucas ... .The new Starwars lit
27,StarWars,LEGO Millennium Falcon BNIB Ends h Last Price GBP 0
28,StarWars,It possible negative opinion Star Wars past present absolute flog
29,StarWars,He sarcastic everyone
30,StarWars,Let war critics fans continue lol Looking forward conversation next years
31,StarWars,RT amp follow chance WIN Kylo Ren Pop
32,StarWars,Redid covers new Steam/Origin template
33,StarWars,films trilogies decades tonight witness end The Skywalker Saga
34,StarWars,skipp gapernah liat starwars
35,StarWars,About last night premiere London
36,StarWars,RT amp follow chance WIN Kylo Ren Pop
37,StarWars,The Hope gone The Skywalkers gone You end saga killing one suffered You
38,StarWars,A special light saber tribute opening night Hollywood The Rise
39,StarWars,RT amp follow chance WIN Kylo Ren Pop
40,StarWars,RT amp follow chance WIN Kylo Ren Pop
41,StarWars,'m disgusted 's promoted `` making history '' c
42,StarWars,The Rise Skywalker two films worth information amp crazy stuff jammed one makes lac
43,StarWars,I loved Oh god ending stuck landing amp phenomenal performance everyone I
44,StarWars,This final word story Skywalker See theaters tonight Get tickets h
45,StarWars,RT amp follow chance WIN Kylo Ren Pop
46,StarWars,All Fortnite Winterfest presents Star Wars present boxes gifts Better view verified Having problem f
47,StarWars,About last night premiere London
48,StarWars,Tonight 's night RT amp Follow chance win Exclusive Mos Eisley C
49,StarWars,RT amp follow chance WIN Kylo Ren Pop
50,StarWars,Waking sea positivity notifications DM The Rise Skywalker let anyone form opini
51,StarWars,The Force strong today 's Sideshow Spectacular select in-stock items
52,StarWars,shooting 's beautiful desert It 's hard believe
53,StarWars,FREE SKATE SATURDAYS Included match ticket Saturday post-game skate You jump straight afte
54,StarWars,Ad hominem I 've never seen anyone 's core criticism Disney trilogy `` 's l
55,StarWars,Yes Poe I know Kylo Ren He seem THAT bad Lovely meeting Adam Driver Oscar Isaac They great
56,StarWars,RT amp follow chance WIN Kylo Ren Pop
57,StarWars,All Fortnite Winterfest presents Star Wars present boxes gifts Better view verified Having problem
58,StarWars,Last night I watched group friends best eerienced together let 's tr
59,StarWars,absolutely bonkers It allows fans choose ending series Hat
60,StarWars,Well well well look decided show
61,StarWars,It 's day theaters today pumped Here
62,StarWars,What end These films altered I bittersweet know A story spans ye
63,StarWars,Novels supplemental movies still reinforced continuum lor
64,StarWars,Characters I proud helped bring life part th
65,StarWars,Yeah like finale disappointing masterpieces went shit
66,StarWars,RT amp follow chance WIN Kylo Ren Pop
67,StarWars,... .and fucking great one
68,StarWars,RT amp follow chance WIN Kylo Ren Pop
69,StarWars,`` Episode IX The Rise Skywalker '' along parents two friends God great movie heck I mean I
70,StarWars,Not sure bots definitely felt like written someone r/saltierthancrait
71,StarWars,Coming soon Mighty Crown STAR WARS Coming soon
72,StarWars,RT amp follow chance WIN Kylo Ren Pop
73,StarWars,Lol I 'm allowed give view like many people Btw I done pe
74,StarWars,luke anakins entire purpose became pointless revealed palpati
75,StarWars,In 'Return Jedi 1983 kicks stairs giving Luke high ground Va
76,StarWars,RT amp follow chance WIN Kylo Ren Pop
77,StarWars,Nothing prepare end playing theaters Get tickets
78,StarWars,Thank much kind tweets I really appreciate I honored proud movie
79,StarWars,Drawing New Star Wars Old Star Wars I 'm happy contribute saga little w
80,StarWars,RT amp follow chance WIN Kylo Ren Pop
81,StarWars,I think people eect feel wonder back I doubt I l
82,StarWars,`` Episode IX The Rise Skywalker '' along parents two friends God great movie heck I mean
83,StarWars,way x
84,StarWars,RT amp follow chance WIN Kylo Ren Pop
85,StarWars,Our studios Sterling Heights today
86,StarWars,Took snap gal excellent General Hux cosplay European premiere She even nailed Hux
87,StarWars,Spoiler free thoughts I enjoyed I laughed I cried I cheered Was pacing little
88,StarWars,Nothing prepare end playing theaters Get tickets
89,StarWars,Going selfies people shared far I love family
90,StarWars,RT amp follow chance WIN Kylo Ren Pop
91,StarWars,Ca n't see new film tonight Have listen interview I last year It epic
92,StarWars,Who going see movie opening night
93,StarWars,My daughter would love go next Friday
94,StarWars,thanks everyone involved came back watching second time lo
95,StarWars,Anakin Chosen One George Lucas
96,StarWars,The Rise Skywalker finally What think film NO Spoilers Please
97,StarWars,RT amp follow chance WIN Amazon Exclusive Han solo Millennium Falcon Pop Deluxe
98,StarWars,How I thought scenes random Have fun
99,StarWars,Good question I quite often pondered
